<?xml version="1.0" encoding="UTF-8"?>
<xs:schema xmlns:xs="http://www.w3.org/2001/XMLSchema"
           targetNamespace="https://www.w3schools.com"
           xmlns:mns="https://www.w3schools.com"
           elementFormDefault="qualified">
    <xs:element name="touristVouchers">
        <xs:complexType>
            <xs:sequence>
                <xs:element name="voucher" minOccurs="16" maxOccurs="unbounded">
                    <xs:complexType>
                        <xs:sequence>
                            <xs:element name="country" type="xs:string"/>
                            <xs:element name="date" type="xs:date"/>
                            <xs:element name="duration">
                                <xs:complexType>
                                    <xs:simpleContent>
                                        <xs:extension base="xs:integer">
                                            <xs:attribute name="unit">
                                                <xs:simpleType>
                                                    <xs:restriction base="xs:string">
                                                        <xs:enumeration value="days"/>
                                                        <xs:enumeration value="nights"/>
                                                    </xs:restriction>
                                                </xs:simpleType>
                                            </xs:attribute>
                                        </xs:extension>
                                    </xs:simpleContent>
                                </xs:complexType>
                            </xs:element>
                            <xs:element name="transport">
                                <xs:simpleType>
                                    <xs:restriction base="xs:string">
                                        <xs:enumeration value="air"/>
                                        <xs:enumeration value="auto"/>
                                        <xs:enumeration value="railway"/>
                                        <xs:enumeration value="water"/>
                                    </xs:restriction>
                                </xs:simpleType>
                            </xs:element>
                            <xs:element name="cost">
                                <xs:complexType>
                                    <xs:simpleContent>
                                        <xs:extension base="xs:integer">
                                            <xs:attribute name="currency" use="required">
                                                <xs:simpleType>
                                                    <xs:restriction base="xs:string">
                                                        <xs:enumeration value="BYN"/>
                                                        <xs:enumeration value="USD"/>
                                                        <xs:enumeration value="EURO"/>
                                                    </xs:restriction>
                                                </xs:simpleType>
                                            </xs:attribute>
                                        </xs:extension>
                                    </xs:simpleContent>
                                </xs:complexType>
                            </xs:element>
                            <xs:element name="hotelCharacteristics">
                                <xs:complexType>
                                    <xs:sequence>
                                        <xs:element name="hotelName" type="xs:string"/>
                                        <xs:element name="nutrition" default="HB">
                                            <xs:simpleType>
                                                <xs:restriction base="xs:string">
                                                    <xs:pattern value="HB|BB|AI"/>
                                                </xs:restriction>
                                            </xs:simpleType>
                                        </xs:element>

                                        <xs:element name="persons">
                                            <xs:simpleType>
                                                <xs:restriction base="xs:integer">
                                                    <xs:pattern value="[1-4]"/>
                                                </xs:restriction>
                                            </xs:simpleType>
                                        </xs:element>
                                    </xs:sequence>
                                    <xs:attribute name="stars" use="required">
                                        <xs:simpleType>
                                            <xs:restriction base="xs:integer">
                                                <xs:pattern value="[1-5]"/>
                                            </xs:restriction>
                                        </xs:simpleType>
                                    </xs:attribute>
                                    <xs:attribute name="tv">
                                        <xs:simpleType>
                                            <xs:restriction base="xs:string">
                                                <xs:enumeration value="LG"/>
                                                <xs:enumeration value="Samsung"/>
                                                <xs:enumeration value="Bosch"/>
                                            </xs:restriction>
                                        </xs:simpleType>
                                    </xs:attribute>
                                    <xs:attribute name="conditioner">
                                        <xs:simpleType>
                                            <xs:restriction base="xs:string">
                                                <xs:enumeration value="LG"/>
                                                <xs:enumeration value="Samsung"/>
                                                <xs:enumeration value="Bosch"/>
                                            </xs:restriction>
                                        </xs:simpleType>
                                    </xs:attribute>
                                </xs:complexType>
                            </xs:element>
                        </xs:sequence>
                        <xs:attribute name="type" use="required">
                            <xs:simpleType>
                                <xs:restriction base="xs:string">
                                    <xs:pattern value="weekend|excursion|rest|pilgrimage"/>
                                </xs:restriction>
                            </xs:simpleType>
                        </xs:attribute>
                        <xs:attribute name="id" type="xs:string" use="required"/>
                    </xs:complexType>
                </xs:element>
            </xs:sequence>
        </xs:complexType>
        <xs:unique name="uniqueId">
            <xs:selector xpath="mns:voucher" />
            <xs:field xpath="@id" />
        </xs:unique>
    </xs:element>



</xs:schema>